{
  "name": "artemis-android",
  "description": "Android game streaming client for Windows PC to Android device with custom virtual controls and gamepad support",
  "category": "utilities/system-tools",
  "subcategory": "streaming-client", 
  "tags": ["android", "streaming", "gaming", "mobile", "gamepad", "moonlight", "client"],
  "repository": "https://github.com/ClassicOldSong/moonlight-android",
  "license": "GPL-3.0",
  "platforms": ["Linux"],
  "language": "Java",
  "maintainer": {
    "name": "ClassicOldSong",
    "github": "ClassicOldSong"
  },
  "added_date": "2025-01-15",
  "contributed_by": "claude-assistant"
}