{
  "name": "Apollo",
  "description": "Self-hosted desktop streaming host for games and applications with HDR support and low-latency streaming",
  "category": "utilities/system-tools",
  "subcategory": "streaming",
  "tags": ["streaming", "gaming", "desktop", "hdr", "self-hosted", "moonlight", "gpu"],
  "repository": "https://github.com/ClassicOldSong/Apollo",
  "license": "GPL-3.0",
  "platforms": ["Windows", "Linux", "macOS"],
  "language": "C++",
  "maintainer": {
    "name": "ClassicOldSong",
    "github": "ClassicOldSong"
  },
  "added_date": "2025-01-15",
  "contributed_by": "claude-assistant"
}